{
  "schema_version": "1.0.0",
  "specification": {
    "id": "https://w3id.org/battinfo/cell-type/3f7k-2m9r-4t6p-8v5q",
    "manufacturer": "AlphaLab",
    "model": "POUCH-SL-LFP-001",
    "format": "pouch",
    "chemistry": "Li-ion",
    "positive_electrode_basis": "LFP",
    "negative_electrode_basis": "graphite",
    "construction": {
      "assembly_type": "stacked",
      "layering": "single_layer",
      "layer_count": 1,
      "comment": "Single-layer pouch alpha fixture."
    },
    "property": {
      "nominal_capacity": {
        "value": 0.12,
        "unit": "Ah"
      },
      "nominal_voltage": {
        "value": 3.2,
        "unit": "V"
      }
    },
    "positive_electrode": {
      "coating": {
        "component": {
          "active_material": [
            {
              "name": "LFP",
              "property": {
                "mass_fraction": {
                  "value": 0.93,
                  "unit": "1"
                }
              }
            }
          ],
          "binder": [
            {
              "name": "PVDF",
              "property": {
                "mass_fraction": {
                  "value": 0.04,
                  "unit": "1"
                }
              }
            }
          ],
          "additive": [
            {
              "name": "Carbon black",
              "property": {
                "mass_fraction": {
                  "value": 0.03,
                  "unit": "1"
                }
              }
            }
          ]
        },
        "property": {
          "loading": {
            "value": 14.0,
            "unit": "mg/cm^2"
          }
        }
      },
      "current_collector": {
        "name": "Al foil"
      }
    },
    "negative_electrode": {
      "coating": {
        "component": {
          "active_material": [
            {
              "name": "Graphite",
              "property": {
                "mass_fraction": {
                  "value": 0.95,
                  "unit": "1"
                }
              }
            }
          ],
          "binder": [
            {
              "name": "CMC/SBR",
              "property": {
                "mass_fraction": {
                  "value": 0.05,
                  "unit": "1"
                }
              }
            }
          ]
        },
        "property": {
          "loading": {
            "value": 8.0,
            "unit": "mg/cm^2"
          }
        }
      },
      "current_collector": {
        "name": "Cu foil"
      }
    },
    "electrolyte": {
      "family": "organic",
      "solvent_mixture": {
        "component": [
          {
            "name": "EC",
            "property": {
              "volume_fraction": {
                "value": 0.4,
                "unit": "1"
              }
            }
          },
          {
            "name": "EMC",
            "property": {
              "volume_fraction": {
                "value": 0.6,
                "unit": "1"
              }
            }
          }
        ]
      },
      "salt": {
        "name": "LiPF6",
        "property": {
          "concentration": {
            "value": 1.0,
            "unit": "mol/L"
          }
        }
      }
    },
    "separator": {
      "material": "PP membrane",
      "property": {
        "thickness": {
          "value": 16.0,
          "unit": "um"
        }
      }
    },
    "comment": [
      "Detailed single-layer pouch descriptor for alpha validation coverage."
    ]
  },
  "instances": [
    {
      "name": "pouch-sl-alpha-01",
      "id": "https://w3id.org/battinfo/cell/8m4q-6t2p-9r5v-3k7n",
      "serial_number": "POUCH-SL-ALPHA-01"
    }
  ],
  "provenance": {
    "source_type": "manual",
    "source_name": "BattINFO alpha fixtures",
    "source_file": "assets/examples/battery-descriptors/alpha-pouch-single-layer-detailed.example.json",
    "retrieved_at": 1773201600,
    "workflow_version": "alpha-fixtures-0.1",
    "comment": "Canonical detailed single-layer pouch fixture."
  },
  "comment": [
    "Alpha fixture for detailed single-layer pouch-cell descriptions."
  ]
}
