{
  "schema_version": "1.0.0",
  "specification": {
    "id": "https://w3id.org/battinfo/cell-type/1c4m-7p9q-2k6t-8v3r",
    "manufacturer": "AlphaLab",
    "model": "COIN-LFP-2032",
    "format": "coin",
    "chemistry": "Li-ion",
    "positive_electrode_basis": "LFP",
    "negative_electrode_basis": "graphite",
    "size_code": "2032",
    "construction": {
      "assembly_type": "stacked",
      "layering": "not_applicable",
      "comment": "Coin-cell alpha fixture with stacked pellet-style components."
    },
    "property": {
      "nominal_capacity": {
        "value": 0.04,
        "unit": "Ah"
      },
      "nominal_voltage": {
        "value": 3.2,
        "unit": "V"
      }
    },
    "positive_electrode": {
      "coating": {
        "component": {
          "active_material": [
            {
              "name": "LFP",
              "property": {
                "mass_fraction": {
                  "value": 0.92,
                  "unit": "1"
                }
              }
            }
          ],
          "binder": [
            {
              "name": "PVDF",
              "property": {
                "mass_fraction": {
                  "value": 0.04,
                  "unit": "1"
                }
              }
            }
          ],
          "additive": [
            {
              "name": "Carbon black",
              "property": {
                "mass_fraction": {
                  "value": 0.04,
                  "unit": "1"
                }
              }
            }
          ]
        },
        "property": {
          "thickness": {
            "value": 55.0,
            "unit": "um"
          }
        }
      },
      "current_collector": {
        "name": "Al foil"
      }
    },
    "negative_electrode": {
      "coating": {
        "component": {
          "active_material": [
            {
              "name": "Graphite",
              "property": {
                "mass_fraction": {
                  "value": 0.95,
                  "unit": "1"
                }
              }
            }
          ],
          "binder": [
            {
              "name": "CMC/SBR",
              "property": {
                "mass_fraction": {
                  "value": 0.05,
                  "unit": "1"
                }
              }
            }
          ]
        },
        "property": {
          "thickness": {
            "value": 48.0,
            "unit": "um"
          }
        }
      },
      "current_collector": {
        "name": "Cu foil"
      }
    },
    "electrolyte": {
      "family": "organic",
      "solvent_mixture": {
        "component": [
          {
            "name": "EC",
            "property": {
              "volume_fraction": {
                "value": 0.5,
                "unit": "1"
              }
            }
          },
          {
            "name": "DEC",
            "property": {
              "volume_fraction": {
                "value": 0.5,
                "unit": "1"
              }
            }
          }
        ]
      },
      "salt": {
        "name": "LiPF6",
        "property": {
          "concentration": {
            "value": 1.0,
            "unit": "mol/L"
          }
        }
      }
    },
    "separator": {
      "material": "PP membrane",
      "property": {
        "thickness": {
          "value": 20.0,
          "unit": "um"
        }
      }
    },
    "comment": [
      "Detailed coin-cell descriptor for alpha validation coverage."
    ]
  },
  "instances": [
    {
      "name": "coin-alpha-01",
      "id": "https://w3id.org/battinfo/cell/6d2k-4m8p-7t3v-9q5r",
      "serial_number": "COIN-ALPHA-01"
    }
  ],
  "provenance": {
    "source_type": "manual",
    "source_name": "BattINFO alpha fixtures",
    "source_file": "examples/cell-descriptors/alpha-coin-detailed.example.json",
    "retrieved_at": 1773201600,
    "workflow_version": "alpha-fixtures-0.1",
    "comment": "Canonical detailed coin-cell fixture."
  },
  "comment": [
    "Alpha fixture for detailed coin-cell descriptions."
  ]
}


